{
  "schemaVersion": 1,
  "id": "valid-panel-grid",
  "title": "Panel grid layout",
  "learningQuestion": "Which cards share a panel?",
  "evidence": { "status": "confirmed", "sources": ["fixture"] },
  "layout": { "type": "panel-grid" },
  "components": [
    { "id": "input", "type": "card", "title": "Input", "body": ["Read the source"], "row": 0, "column": 0 },
    { "id": "transform", "type": "card", "title": "Transform", "body": ["Normalize data"], "row": 0, "column": 1 },
    { "id": "output", "type": "card", "title": "Output", "body": ["Write the result"], "row": 0, "column": 0 }
  ],
  "connectors": [
    { "id": "input-transform", "source": "input", "target": "transform", "label": "next", "style": "solid" },
    { "id": "transform-output", "source": "transform", "target": "output", "label": "retry", "style": "dashed" }
  ]
}
