{
  "schemaVersion": 1,
  "id": "long-cjk",
  "title": "Long CJK layout",
  "learningQuestion": "How does content expand safely?",
  "evidence": { "status": "confirmed", "sources": ["fixture"] },
  "layout": { "type": "flow-row" },
  "components": [
    { "id": "long-title", "type": "card", "title": "这是一个用于验证固定字体自动换行并安全扩高的超长中文标题", "body": ["标题换行不能依赖降低字体或无限加宽卡片。"] },
    { "id": "prepare", "type": "card", "title": "准备阶段", "body": ["将原始输入转换为可重复验证的规范化结构，并保留完整来源信息。", "所有边界和间距必须在两种渲染格式中保持一致，并且每一行文本都需要保留完整的安全余量。", "当描述包含连续中文字符时，布局器应当根据确定性宽度估算主动换行，不依赖操作系统字体测量结果。"] },
    { "id": "render", "type": "card", "title": "渲染阶段", "body": ["长中文内容必须在不降低字号的前提下自动换行并扩展卡片高度。", "连接器应当只经过卡片之间预留的走廊，不能穿过任何无关卡片的内容区域。", "SVG 与 Draw.io 渲染器都应消费同一个布局文档，从而保持相同的画布边界、卡片间距和文字安全范围。"] }
  ],
  "connectors": [
    { "id": "prepare-render", "source": "prepare", "target": "render", "label": "安全交接", "style": "solid" }
  ]
}
