{
  "schemaVersion": 1,
  "id": "valid-timeline",
  "title": "Timeline layout",
  "learningQuestion": "How do stages advance?",
  "evidence": { "status": "confirmed", "sources": ["fixture"] },
  "layout": { "type": "timeline-row" },
  "components": [
    { "id": "plan", "type": "card", "title": "Plan", "body": ["Define the input"] },
    { "id": "build", "type": "card", "title": "Build", "body": ["Create the artifact"] },
    { "id": "verify", "type": "card", "title": "Verify", "body": ["Check the result"] }
  ],
  "connectors": [
    { "id": "plan-build", "source": "plan", "target": "build", "label": "handoff", "style": "solid" },
    { "id": "build-verify", "source": "build", "target": "verify", "label": "", "style": "solid" },
    { "id": "plan-verify", "source": "plan", "target": "verify", "label": "skip", "style": "solid" }
  ]
}
