{
  "schemaVersion": 1,
  "id": "valid-flow",
  "title": "编译到执行",
  "learningQuestion": "代码怎样到达执行入口？",
  "evidence": { "status": "confirmed", "sources": ["fixture"] },
  "layout": { "type": "flow-row" },
  "components": [
    { "id": "compile", "type": "card", "groupId": "main", "title": "编译", "body": ["生成代码载体"], "status": "产物已生成" },
    { "id": "launch", "type": "card", "groupId": "main", "title": "启动", "body": ["查询入口并提交"], "status": "任务已提交" }
  ],
  "connectors": [
    { "id": "compile-launch", "source": "compile", "target": "launch", "label": "注册后查询", "style": "dashed" }
  ]
}
